0,0,1,2,2.0,2.0,3.0,1.0,1.0,3.0,1.0,1.0,1.0,"Noticing how three weeks felt like very short time once collecting data versus how I felt before the experiment, thinking how long it was going to be. ",4.0,3.0,I learned that students need to feel responsible for something and be held accountable other wise they may just not care about what does not belong to them. ,"I felt like trying something new at the end of the school year really refreshed my students and made them excited again. So, it has impacted me by showing me to be that teacher that tries new things and brings an excitement to class. ","My intended outcome was to see if students being held accountable for a tangible item could help decrease their pencil interruptions during instruction. This study helped me see that this was leading to become a non interrupted class due to pencils. Pencil management, if continued would have been solved. ",0
0,0,2,2,2.0,2.0,3.0,3.0,3.0,3.0,2.0,2.0,2.0,One challenge was motivating students. ,4.0,5.0,Students do not know how to efficiently study. I learned that giving them study tasks helped their test scores. ,I now see how I will be doing this kind of all the time in my classroom. Trial and error to improve my classroom. ,"Students enjoy having something creative. For example, having them create their own graphic organizer. ",0
1,0,2,2,3.0,1.0,2.0,3.0,2.0,4.0,2.0,2.0,1.0,I found it hard to actually write up the plan of study. I had no idea for how to write up an IRB plan at all.,3.0,2.0,I learned that these students appreciated being treated with responsibility and that this opportunity made them feel respected. I realized that I enjoy facilitating learning and giving opportunities rather than directing.,It made me feel as though I had a lot more to learn and that I am still coming into my own as a teacher. It made me feel as though there is much more work I need to do on myself.,I found that students become much more engaged when you allow them to pursue their own interests.  I intended to find whether students became more engaged if given freedom to pursue their interests.,1
0,0,1,2,3.0,1.0,3.0,3.0,3.0,3.0,3.0,3.0,2.0,"Pluses: three-week research study only before LEAP

Challenges: getting the results I wanted from the students 

Interesting Elements: seeing how the students rated themselves, honesty ",5.0,5.0,"When asking students to rate themselves, half were honest while the other half were not. Improving student accountability takes time. ","It's important to allow students multiple opportunities to collaborate, through group activities, in order for them to learn important life skills. ",Students started taking more accountability for their learning and actions. ,0
0,0,1,2,3.0,1.0,3.0,3.0,3.0,3.0,3.0,3.0,2.0,"Pluses: three-week research study only before LEA

Challenges: getting the results I wanted from the students

Interesting Elements: seeing how the students rated themselves, honesty",5.0,5.0,"When asking students to rate themselves, half were honest while the other half were not. Improving student accountability takes time.","It's important to allow students multiple opportunities to collaborate, through group activities, in order for them to learn important life skills.",Students started taking more accountability for their learning and actions.,0
0,0,1,2,3.0,1.0,4.0,3.0,4.0,3.0,2.0,2.0,1.0,Students participated and reacted in a positive manner to the project. The only challenge was to get students to return consent forms.,3.0,3.0,"When incentives are offered, students are willing to work hard and do as they should.",To allow my students to have chances and to reward them for good deeds. Students handle a lot with school and all the work that has to be done. ,"Outcomes I found within my study were students being on task, participating in class, collaborating with group members, working diligently, and paying attention. The outcomes I found, were the outcomes I intended to find. There was a significant change between the first week of observations and the second week of implementing the competition.",0
0,1,1,2,2.0,2.0,2.0,3.0,3.0,2.0,3.0,3.0,1.0,"The positive side of this process was seeing how simple it is to incorporate small things into the classroom to make a big change. The process of completing the study (data gathering, implementing intervention) while teaching was the most challenging part of this process. The most interesting elements of these stages was seeing the positive impact of the intervention in my classroom and being able to analyze the data to see what worked and when.",4.0,2.0,I learned that my students are much more interested in behaving when there is some positive to come from it. They were less interested in behaving when we were not running the intervention strategy chosen.,"This study has not impacted my perception of myself as a teacher, but it has helped me to better learn how my students respond to different behavior management strategies.",I found that students were much more likely to behave when they were being held accountable for the success of their classmates as well as themselves. Many students displayed more positive behaviors during the intervention and it even trickled into the next week while data collection was still going on. ,0
0,0,1,2,4.0,2.0,3.0,3.0,2.0,3.0,3.0,2.0,1.0,This process seemed daunting at first but ended up being very simple. This process helped me to realize how expansive my knowledge of education has become over the last four years. The hardest part was deciding which problem was worth choosing and overcoming the fear of trying new things. ,4.0,3.0,Some students will be very responsive to certain teaching strategies while others will not. Teaching is never a one-size-fits-all profession.,"This study has helped me realize that I knew my students on a deep, personal level. The small data results may not be very meaningful to many others, but it was very interesting and informative for me having the student background knowledge to examine as well.","I intended to find the degree to which students respond to incentives for doing things that they are usually unmotivated to do. I believe that I did achieve these outcomes as I was able to witness different students providing diverse data. Some students will respond as you hope, while others will need different management strategies to feel motivated.",0
0,0,0,2,2.0,1.0,4.0,3.0,3.0,2.0,3.0,2.0,2.0,"I think a plus of this research project was the realization of issues within the classroom and finding a potential solution to them rather than just letting them happen. If I hadn't intervened with this research project, my participant would still continue to be sleeping throughout lessons daily. This research project has kept her awake and has improved her learning. The challenge of this project was just remembering to write down and keep track of when she fell asleep, the duration of sleep, as well as her participation in class. The school days are definitely chaotic so it was tricky to remember sometimes! Lastly, I found it interesting how closely linked her sleeping patterns and participation in class seemed to be. By week three, she was not sleeping at all and her participation level doubled from the two weeks prior.",3.0,4.0,"I learned that children need to give their brains a rest throughout the school day for at least a short period of time. They learn so much in one day and don't even have nap time even though they are only in kindergarten. I think taking a short break, especially during an extensive lesson, will end up helping them learn more in the end.","I do think this research project has impacted my perception of myself as a teacher. I think it has taught me to reflect on my students and really pay attention to their needs. If a child is struggling, help them. If a child keeps falling asleep in the classroom, figure out why and try everything you can to help them be as successful as possible.","As a result of this study, I found that sleeping patterns have a direct correlation on a child's success and participation in the classroom. This was an outcome I intended to find and I am glad my research was able to prove this. An intended outcome that did not occur was I expected my participant to sleep less by week tho, which technically did happen (slept twice in week one and only once in week two), however, the duration of sleep was longer in week two. Regardless, this research study decreased the times in which she slept in class while increasing the times in which she was on task and participating.",1
0,0,1,2,2.0,2.0,2.0,2.0,2.0,2.0,2.0,2.0,2.0,This project really helped me help students become more prepared each day. The students were using less instructional time looking for a pencil. Positive reinforcement helped my students want to be prepared and they looked forward to earning their leader bucks each week. The only slight difficulty I had with the project was receiving consent forms on time. ,5.0,5.0,"I learned that y students respond really well to positive reinforcement in the classroom. Also, having something like ""leader bucks"" in the classroom helps students learn how to have a growth mindset. ",Conducting this study positively impacted my perception of myself as a teacher. The study helped me realize how positive reinforcement can help all students learn to have a growth mindset and want to succeed in the classroom. ,"Overall, implementing the chart and positive reinforcement did seem to help students keep track of their pencils and be prepared during class. After students not receiving the reward for week 1, the two following weeks consisted of students being prepared every day and were looking forward to receiving their 5 leader bucks. It seems that students responded well to positive reinforcement for week 2 and ended up earning the reward for the following week as well. However, if this study was to be done again over a longer time period, results may be different.
",0
0,0,0,2,2.0,2.0,3.0,2.0,2.0,2.0,1.0,2.0,1.0,"Throughout this process, a new way was found for me to manage classroom behavior. Not only did it help students to monitor themselves individually, but it also helped them to stay motivated to work as a team towards their goals. The main challenge was reinforcing the beans earned to students displaying desired behavior rather than focusing on those who were not doing so. I found it interesting when I would pick up a handful of beans and walked around, students seemed to straighten up and exemplify desired behavior if they weren't before.",4.0,4.0,"Throughout this process, I learned that my students are creatures of habit. When I began awarding beans first thing in the morning, they were more conscious of their behavior for the rest of the day. If I would remember to give out beans later in the day, their behavior seemed more inconsistent. Overall, I learned that my students achieve more when they work as a team. From experience, their individual incentives in our classroom tend to get forgotten about, but group incentives in our class typically get earned much quicker and more frequently. As a supporter of learning, I learned that I get better results when positive reinforcement is involved. ","Before conducting this study, I truly did not think I was capable of creating and maintaining my own behavior management. I have always just gone along and implemented the previous routines and procedures in my mentor's classroom. I learned that I am capable of creating a positive classroom management technique that helps students individually and helps to build classroom culture. ","After this study, I have realized that many students respected me and were more willing to show desired behavior when I positively reinforced their actions. By the end of the study, the intended outcome was to decrease outbursts and disruptions during instruction time through positive reinforcement and incentives. This was the only main outcome that was intended and that did occur. This was ultimately achieved by the end of the three week study. ",0
1,0,2,2,3.0,3.0,2.0,4.0,3.0,3.0,3.0,3.0,3.0,"Conducting the study was a challenge as I felt that things were constantly not going my way, but this caused my to adapt and adjust my study to accommodate these challenges.",4.0,4.0,"I have learned that my students are much more responsive to cooperative learning, and enjoy interacting and discussing the classes content together.",This study impacted my perception of myself as a teacher as it showed me the importance of finding the best teaching practices in order to give my students the best education possible.,"As a result of my study, I found that students were more receptive to cooperative learning activities within the classroom on average. This is the outcome I intended to find, sadly due to shortened timeframe for my study, I did not recognize and unexpected outcomes.",0
0,0,0,2,3.0,1.0,3.0,2.0,3.0,3.0,1.0,2.0,1.0,"I found the main challenge that I had was with time. I was behind on data gathering from the start because of IRB and when I wanted to get started my school was doing practice LEAP testing. I also had a struggle with putting my findings into a data chart to fully explain what I had learned. 
I did find it interesting how much I did find out about this student and trying different aspects of my research to find what worked and what did not work for this student.",4.0,5.0,I learned that the student I researched does well with a reward system and that he also works well with consistent positive praises. I made it a point to constantly give him oral praises with positive reinforcements. ,Conducting this study may have impacted my perception of myself as a teacher because I now can see how differentiated my instruction needs to be between different students because every student is different and may need to learn in different ways.,"In my study I found that this student works best with structure. He also works well with a reward system and when he is working towards something. I noticed that this student has less frustration and anxiety during subjects he is more comfortable with like reading. Where as in math, the student tended to get more off task and result in frustration because the student was not comfortable with this subject. This is when I used one on one instruction and positive reinforcement with the student and saw improvements.",0
0,0,1,2,1.0,1.0,3.0,3.0,2.0,2.0,1.0,3.0,1.0,"The students who never give me problems (never talked) in the classroom were the ones who loved the ""Blurt Beans"" strategy the most. ",3.0,3.0,"I learned that not all students react to behavior management strategies in the same way. For instance, the students who have major blurting tendencies were not fazed by the ""Blurt Beans"" strategy. ","This strategy made me realize that not as ""on top"" of things as a teacher. Some days I would not take beans from blurting students and give them more opportunities to fix their behaviors. ","Overall, the blurt beans strategy is not effective for all types of students. This strategy worked exceptionally for a child with minor blurting tendencies. ",0
0,0,2,2,3.0,2.0,4.0,3.0,2.0,3.0,2.0,2.0,2.0,"I think the biggest set back was how long it took to get IRB approval. My only suggestion would be to speed up the beginning process as much as possible and get the IRB applications in sooner so that we have more then just the end of the semester to conduct the study. So many of us planned our study and February and didn't actually flush it out till April which means we could be teaching in a completely different unit and style depending on testing and residency schedules. I completely understand how this hard juggle but maybe doubling up on some of the earlier assignments, specifically the smaller ones, can help with this. ",4.0,2.0,I definitely learned that their influence on each other is much stronger than mine. But if I find ways to use that to my advantage then I can still assert my authority over the classroom environment.,It made me realize I am not a strict teacher. That is definitely something I'm gonna have to work on. It's easy for me to let things slide but I have to work on  being consistent. ,I expected most of the outcomes. They followed a common pattern throughout the year. Students start out the week less talkative and then gradually get more out of hand with their behavior. This reflected in my study but I was shocked to see the self regulation that set in place for several of the students in the study as we neared the end and got closer to their incentive. ,0
0,0,2,2,5.0,5.0,3.0,5.0,3.0,3.0,3.0,2.0,5.0,The process was a bit fast. Everything needed to be completed in a small time frame. ,3.0,3.0,"Students often lack in accountability, but when guided can increase their responsibility ",N/a,All outcomes seemed to be met within my study. ,1
0,1,3,1,3.0,1.0,5.0,2.0,1.0,1.0,1.0,1.0,1.0,It was interesting to see that by using the guided notes the students actually paid more attention during instruction. ,2.0,3.0,I learned that my students do much better when they have an outline of notes to follow during instruction. It is easier for them to distinguish between the important topics and less important topics. ,I learned that I can test my strategies through studies in the classroom to find out if they will actually work. ,"The outcomes that I intended to find where that guided notes helped increase student test scores, this outcome did occur at the end of the study. 

Some outcomes that emerged unexpectedly were higher attention from students during instruction and higher participation in class discussion, which I contributed to student being able to study their notes at home so they are more familiar with the material and in turn are more confident when participating in class. ",0
0,0,2,1,3.0,2.0,3.0,4.0,3.0,3.0,2.0,3.0,2.0,I liked seeing students' positive reactions to the study and seeing how the study actually helped them in the end. ,5.0,3.0,"Most students need the push towards self reflection and accountability, but once they get into the routine of constantly reflecting on class and their understanding, their grade will reflect that positive change. ","I will definitely include some sort of self-reflection into my lessons, whether it be weekly or daily. I liked using it as an exit ticket and using the written responses as a way to slightly tweak my lesson as the day goes on to better fit my students. ","I intended to find an increase in participation in class since the students were instructed to grade themselves on participation. I intended for some students to not participate at all, which did happen at first, but eventually, all students submitted responses each time they were assigned an exit ticket. I did not expect to see such a drastic increase in grades on some students in such a short period of time. ",1
0,0,1,1,3.0,5.0,3.0,5.0,5.0,4.0,5.0,5.0,4.0,"I really enjoyed the challenge of trying something new in the classroom in order to illicit change. It was also a great outlet for creativity in the classroom, which any teacher can appreciate! I think the most challenging part of the project for me was finding an issue that we could study quantifiably within the classroom. Once the issue was chosen and my research question was developed, though, it was essentially smooth sailing from there. ",4.0,5.0,"I have learned that students thrive from positive recognition and that incentives do work, as opposed to only giving punishments for students who do not follow expectations. ","Teachers are often seen as the facilitators of learning among students, but we often forget that we are always learning in the classroom along with our students. Through this research project, I was reminded that there is always something new to learn and discover, even for teachers. ","I found that, overall, my students did receive less conduct marks as a result of the VIP table incentive. Because of the fact that we did move students to different tables and our students did take over the conduct mark and VIP table tally tracking jobs in second and third week, there were many changing variables that may have made our results less conclusive. I would love to see if our students continue to receive less conduct marks through the end of the semester now that consistency has settled within our classes. ",0
0,0,0,1,5.0,5.0,2.0,4.0,5.0,5.0,5.0,5.0,5.0,This research allowed the students to improve on blurting during instructional time. I am able to carry out this research after the three weeks and now the students raise their hand for the most part without the incentives. ,4.0,4.0,I learned that some students were blurting out answers right away and not allowing think time for other students. Now I am able to hear all students answers by them raising their hand. ,"As a teacher, I have realized that checking for students understanding is very important. Making sure that all students are heard is very important. If students are constantly blurting out, instructional time is lost and teachers are not able to get through the lesson. ","The outcome that I found is that children are very motivated by rewards. Children will try to perform better when an incentive is in place. They need something to work for, and all of the students in the research have improved on blurting out. Still today all of the students raise their hand instead of blurting out during instructional time. ",0
0,0,0,1,1.0,1.0,2.0,2.0,2.0,2.0,1.0,3.0,2.0,"Throughout this research process, I've learned the positive impacts that introducing non-verbal hand signals had in the classroom. Kindergartners are always so eager to learn and blurting is a part of them being excited to share. I did not want to make them any less eager, rather than incorporate something that would help them share their thoughts more easily. Introducing non-verbal hand signals gave students easy access and shortcuts to getting what they needed whether it be going to the bathroom or sharing the answer. The challenge of this process was finding rewards/incentives that would excite and encourage each student. I was so excited to see how the chosen incentives helped students become more engaged in lessons and aided in classroom management. ",5.0,5.0,"I learned the important role that hand signals can play in classroom management. This changed how fluent each lesson would go. I learned that the students weren't blurting to be disrespectful, rather they just were so eager to share and blurting was the fastest way for them to get their ideas out. Giving students hand signals to use helped them to quickly and non-verbally ask for the bathroom without disrupting the lesson. I learned how impactful nonverbal hand signals can be in my future classroom. ","Conducting this study made me feel more inclined to solve problems as a lead teacher and made me feel more confident in my classroom management skills. I was able to identify a problem, research, and solve the problem. This was so important to me as a future teacher because I was able to discover and achieve things on my own as if I were the lead teacher. This process boosted my self-confidence in tackling difficult areas of management on my own. ","The outcomes of this study showed that students are more motivated when they are interested in the benefits and incentives of the process. Two out of three students showed consistent improvement from weeks 1, 2, and 3. One student showed no improvement with the study. For this student, I incorporated more reminders and positive feedback. Although this student did not improve, he did begin using hand signals more and waiting to be called on instead of often blurting. One student who showed consistent progress in the study surprised me. I realized that watching other students receive incentives encouraged this student to do what she needed to do to reach their goal. ",0
1,0,3,1,3.0,1.0,3.0,4.0,1.0,2.0,2.0,1.0,1.0,"This allowed me to step into the shoes of middle schoolers and see what motivated them, as well as how quickly a student can make adjustments when there is a goal in sight.",3.0,2.0,I learned that my students are eager to join in on the fun that the rest of the class is having. Organization is something that a lot of students lack in middle school.,This changed my perspective by showing me how much of a change students can make when their outcomes are communicated to them.,I found that even these student's grades increased as a result of this emphasis on organization. Students who had a messy backpack at the beginning of the study started showing improvement in their organizational skills and as a result took more pride in their work and work area.,0
